{
  "schema_version": 1,
  "description": "Harness gateway identities and memory trust tiers; consumers read this file, and deployment JSON may override trust_tier per id.",
  "tiers": ["trusted", "untrusted"],
  "default_tier": "untrusted",
  "callers": {
    "claude-code": {"trust_tier": "trusted"},
    "codex": {"trust_tier": "trusted"},
    "opencode-trusted": {"trust_tier": "trusted"},
    "hermes": {"trust_tier": "trusted"},
    "hermes-private": {"trust_tier": "trusted"},
    "donna": {"trust_tier": "trusted"},
    "opencode-untrusted": {"trust_tier": "untrusted"},
    "claude-zai": {"trust_tier": "untrusted"},
    "zcode": {"trust_tier": "untrusted"},
    "antigravity-cli": {"trust_tier": "untrusted"}
  }
}
